<!ELEMENT persoane (persoana+)>
<!ELEMENT persoana (nume,prenume,varsta,adresa,cv)>
<!ATTLIST persoana id CDATA #REQUIRED>

<!ELEMENT nume (#PCDATA)>
<!ELEMENT prenume (#PCDATA)>
<!ELEMENT varsta (#PCDATA)>

<!ELEMENT adresa (strada,numar,localitate,judet,tara)>
<!ELEMENT strada (#PCDATA)>
<!ELEMENT numar (#PCDATA)>
<!ELEMENT localitate (#PCDATA)>
<!ELEMENT judet (#PCDATA)>
<!ELEMENT tara (#PCDATA)>

<!ELEMENT cv (educatie)>
<!ELEMENT educatie (facultate,liceu)>
<!ELEMENT facultate (#PCDATA)>
<!ELEMENT liceu (#PCDATA)>
